{
  "$schema": "../schemas/nockapp-invariant-pack.schema.json",
  "id": "intents-core-v0",
  "name": "Intent Settlement Core",
  "version": "0.1.0",
  "domain": "intents",
  "description": "Safety checks for declaration, solver response, settlement, and failure-free intent lifecycle runs.",
  "upstreamBasis": {
    "repo": "nockchain/nockchain",
    "commit": "33ba97b1e206dd89b15c61b72b7802caf2136c18",
    "build": "build-33ba97b1e206dd89b15c61b72b7802caf2136c18",
    "protocolTrack": "intent-settlement"
  },
  "invariants": [
    {
      "id": "intent-terminal-settled",
      "title": "Intent reaches settled terminal state",
      "severity": "critical",
      "kind": "timeline-state",
      "path": "intent.status",
      "equals": "settled"
    },
    {
      "id": "intent-solver-recorded",
      "title": "Settled intent records the chosen solver",
      "severity": "high",
      "kind": "state-equals",
      "path": "intent.solver",
      "equals": "solver-a"
    },
    {
      "id": "intent-authorized-actors",
      "title": "Intent pokes are performed by authorized actors",
      "severity": "high",
      "kind": "authorized-actor",
      "actors": ["user", "solver-a"],
      "stepType": "poke"
    },
    {
      "id": "intent-no-failure-alert",
      "title": "Intent failure alert remains clear",
      "severity": "critical",
      "kind": "state-equals",
      "path": "alerts.failed",
      "equals": false
    }
  ]
}
